{
  "protocol_version": "codeattest.v0",
  "deletion_evidence_id": "deletion_evidence:del-ev-verified-0001",
  "deleted_artifact_digests": [
    "sha256:6f4b6612125fb3a0daecd2799dfd6c9c299424fd920f9b308110a2c1fbd8f443"
  ],
  "deletion_method": "expiry_purge",
  "deletion_timestamp": "2026-07-19T00:00:01Z",
  "actor": {
    "actor_type": "vendor_service",
    "actor_id": "SYNTHETIC_DEMO_DATA-retention-worker"
  },
  "verification_status": "verified",
  "supersedes_deletion_evidence_ref": "deletion_evidence:del-ev-attempt-0001"
}
